{
  "$schema": "ihris-source-record/v1",
  "id": "release--ihris-qualify--4.0.3",
  "node": "release/ihris-qualify/4.0.3",
  "host": "launchpad",
  "vcs": "bzr",
  "level": "release",
  "refs": {
    "web": "https://launchpad.net/ihris-qualify/+milestone/4.0.3"
  },
  "release": {
    "name": "4.0.3",
    "series": "4.0",
    "released": "2010-03-05",
    "expected": null,
    "registrant": "Luke Duncan",
    "releaseNotes": null,
    "changelog": null,
    "files": [
      {
        "name": "ihris-qualify-full-4_0_3.tar.bz2",
        "url": "https://launchpad.net/ihris-qualify/4.0/4.0.3/+download/ihris-qualify-full-4_0_3.tar.bz2",
        "md5": "6453fe3ceed88e9864421f12b6b784ac"
      },
      {
        "name": "ihris-qualify-4_0_3.tar.bz2",
        "url": "https://launchpad.net/ihris-qualify/4.0/4.0.3/+download/ihris-qualify-4_0_3.tar.bz2",
        "md5": "e7deaee7db58f140baaf5b9fcc469c3d"
      }
    ]
  },
  "capturedFrom": [
    "uploads/launchpad/milestones/ihris-qualify@4.0.3.html",
    "uploads/launchpad/release-file-md5.tsv"
  ],
  "capturedAt": "2026-09-22"
}
