{
  "$schema": "ihris-source-record/v1",
  "id": "release--i2ce--4.0.0",
  "node": "release/i2ce/4.0.0",
  "host": "launchpad",
  "vcs": "bzr",
  "level": "release",
  "refs": {
    "web": "https://launchpad.net/i2ce/+milestone/4.0.0"
  },
  "release": {
    "name": "4.0.0",
    "series": "4.0",
    "released": "2009-07-14",
    "expected": null,
    "registrant": "Luke Duncan",
    "releaseNotes": null,
    "changelog": null,
    "files": [
      {
        "name": "README_4_0_0.txt",
        "url": "https://launchpad.net/i2ce/4.0/4.0.0/+download/README_4_0_0.txt",
        "md5": "9eaa07e7d2473c61f27c5d89016ba157"
      },
      {
        "name": "I2CE-full-4_0_0.tar.bz2",
        "url": "https://launchpad.net/i2ce/4.0/4.0.0/+download/I2CE-full-4_0_0.tar.bz2",
        "md5": "6968bda132c0ae02403fa0cd82ab02a3"
      },
      {
        "name": "I2CE-4_0_0.tar.bz2",
        "url": "https://launchpad.net/i2ce/4.0/4.0.0/+download/I2CE-4_0_0.tar.bz2",
        "md5": "b857b398cf0fee8202e6e95f8bebc43c"
      }
    ]
  },
  "capturedFrom": [
    "uploads/launchpad/milestones/i2ce@4.0.0.html",
    "uploads/launchpad/release-file-md5.tsv"
  ],
  "capturedAt": "2026-09-22"
}
