{
  "$schema": "ihris-source-record/v1",
  "id": "release--ihris-manage--4.0.4",
  "node": "release/ihris-manage/4.0.4",
  "host": "launchpad",
  "vcs": "bzr",
  "level": "release",
  "refs": {
    "web": "https://launchpad.net/ihris-manage/+milestone/4.0.4"
  },
  "release": {
    "name": "4.0.4",
    "series": "4.0",
    "released": "2010-05-04",
    "expected": null,
    "registrant": "Luke Duncan",
    "releaseNotes": null,
    "changelog": null,
    "files": [
      {
        "name": "ihris-manage-full-4_0_4.tar.bz2",
        "url": "https://launchpad.net/ihris-manage/4.0/4.0.4/+download/ihris-manage-full-4_0_4.tar.bz2",
        "md5": "9b2f912c93ecf331746d20da72a5ea27"
      },
      {
        "name": "ihris-manage-4_0_4.tar.bz2",
        "url": "https://launchpad.net/ihris-manage/4.0/4.0.4/+download/ihris-manage-4_0_4.tar.bz2",
        "md5": "a0ab92e1749a5f0d154108f90abf6d64"
      }
    ]
  },
  "capturedFrom": [
    "uploads/launchpad/milestones/ihris-manage@4.0.4.html",
    "uploads/launchpad/release-file-md5.tsv"
  ],
  "capturedAt": "2026-09-22"
}
