{
  "$schema": "ihris-source-record/v1",
  "id": "release--ihris-common--4.0.3",
  "node": "release/ihris-common/4.0.3",
  "host": "launchpad",
  "vcs": "bzr",
  "level": "release",
  "refs": {
    "web": "https://launchpad.net/ihris-common/+milestone/4.0.3"
  },
  "release": {
    "name": "4.0.3",
    "series": "4.0",
    "released": "2010-03-05",
    "expected": null,
    "registrant": "Luke Duncan",
    "releaseNotes": null,
    "changelog": null,
    "files": [
      {
        "name": "ihris-common-full-4_0_3.tar.bz2",
        "url": "https://launchpad.net/ihris-common/4.0/4.0.3/+download/ihris-common-full-4_0_3.tar.bz2",
        "md5": "6249dd63c3e3d2e092de43ef118adad6"
      },
      {
        "name": "ihris-common-4_0_3.tar.bz2",
        "url": "https://launchpad.net/ihris-common/4.0/4.0.3/+download/ihris-common-4_0_3.tar.bz2",
        "md5": "00757915807d93df8398aeaf334f2be1"
      }
    ]
  },
  "capturedFrom": [
    "uploads/launchpad/milestones/ihris-common@4.0.3.html",
    "uploads/launchpad/release-file-md5.tsv"
  ],
  "capturedAt": "2026-09-22"
}
