{
  "$schema": "ihris-source-record/v1",
  "id": "project--indian-ihris",
  "node": "project/indian-ihris",
  "host": "launchpad",
  "vcs": "bzr",
  "level": "project",
  "refs": {
    "lp": "lp:indian-ihris",
    "web": "https://launchpad.net/indian-ihris"
  },
  "project": {
    "name": "indian-ihris",
    "title": "Indian iHRIS",
    "summary": "iHRIS Manage for India.",
    "description": null,
    "registered": "2009-11-10 09:54:25 UTC",
    "licences": [
      "GNU LGPL v3"
    ],
    "languages": [],
    "homepage": null,
    "wiki": null,
    "maintainer": {
      "id": "~ihris-india-team",
      "name": "iHRIS India Team"
    },
    "partOf": "ihris-suite",
    "classification": "country-customization",
    "describedBy": null
  },
  "capturedFrom": [
    "uploads/launchpad/projects/indian-ihris.html",
    "uploads/launchpad/projects/indian-ihris.rdf",
    "uploads/launchpad/projects/indian-ihris__series.html"
  ],
  "capturedAt": "2026-09-22"
}
