{
  "$schema": "ihris-source-record/v1",
  "id": "project--openinfoman",
  "node": "project/openinfoman",
  "host": "launchpad",
  "vcs": "bzr",
  "level": "project",
  "refs": {
    "lp": "lp:openinfoman",
    "web": "https://launchpad.net/openinfoman"
  },
  "project": {
    "name": "openinfoman",
    "title": "openinfoman",
    "summary": "Reference Implementation of InfoManager actor in Care Services Discovery (CSD) using RESTXQ.\n\n(tra-la-la)",
    "description": null,
    "registered": "2013-10-30 02:17:22 UTC",
    "licences": [
      "Apache Licence"
    ],
    "languages": [],
    "homepage": null,
    "wiki": null,
    "maintainer": {
      "id": "~his-interop",
      "name": "HIS Interoperability"
    },
    "partOf": null,
    "classification": "related",
    "describedBy": null
  },
  "capturedFrom": [
    "uploads/launchpad/projects/openinfoman.html",
    "uploads/launchpad/projects/openinfoman.rdf",
    "uploads/launchpad/projects/openinfoman__series.html"
  ],
  "capturedAt": "2026-09-22"
}
