{
  "$schema": "ihris-source-record/v1",
  "id": "release--i2ce--4.1.7",
  "node": "release/i2ce/4.1.7",
  "host": "launchpad",
  "vcs": "bzr",
  "level": "release",
  "refs": {
    "web": "https://launchpad.net/i2ce/+milestone/4.1.7"
  },
  "release": {
    "name": "4.1.7",
    "series": "4.1",
    "released": "2013-08-22",
    "expected": null,
    "registrant": "Carl Leitner",
    "releaseNotes": null,
    "changelog": null,
    "files": [
      {
        "name": "ihris-suite-4.1.7.tar.bz2",
        "url": "https://launchpad.net/i2ce/4.1/4.1.7/+download/ihris-suite-4.1.7.tar.bz2",
        "md5": "5258c9ae190692d968cdf38be50f7324"
      }
    ]
  },
  "capturedFrom": [
    "uploads/launchpad/milestones/i2ce@4.1.7.html",
    "uploads/launchpad/release-file-md5.tsv"
  ],
  "capturedAt": "2026-09-22"
}
