{
  "$schema": "ihris-source-record/v1",
  "id": "project--offline-ihris",
  "node": "project/offline-ihris",
  "host": "launchpad",
  "vcs": "bzr",
  "level": "project",
  "refs": {
    "web": "https://launchpad.net/offline-ihris"
  },
  "project": {
    "name": "offline-ihris",
    "title": "Windows iHRIS",
    "summary": "A Windows version of the iHRIS Suite designed for use in locations where there is no or limited Internet access, or where it is not practical to install a Linux server. It installs all three components of the iHRIS Suite on the Windows desktop.",
    "description": "This project builds on the WAMPServer project to provide a full-stack that can be installed on a Windows Desktop. It is primarily intended for a single user running the software on one desktop computer, although it may be accessed by multiple users via a local area network or the Internet. Windows iHRIS may also be installed with sample data as a demonstration of the program before installing the full server-based version. Advanced users may export data from Windows iHRIS for import into a server-based version of iHRIS using the PHP MyAdmin tool included with Windows iHRIS.  In the future, the ability to import and export data from a primary server will be provided.",
    "registered": "2008-06-12 15:11:26 UTC",
    "licences": [
      "GNU GPL v3"
    ],
    "languages": [
      "PHP"
    ],
    "homepage": "http://www.capacityproject.org/hris/suite/offline_ihris.php",
    "wiki": "http://open.intrahealth.org/",
    "maintainer": {
      "id": "~intrahealth+informatics",
      "name": "IntraHealth Informatics"
    },
    "partOf": "ihris-suite",
    "classification": "tool",
    "describedBy": null
  },
  "capturedFrom": [
    "uploads/launchpad/projects/offline-ihris.html",
    "uploads/launchpad/projects/offline-ihris.rdf",
    "uploads/launchpad/projects/offline-ihris__series.html"
  ],
  "capturedAt": "2026-09-22"
}
