{
  "$schema": "ihris-source-record/v1",
  "id": "repository--iHRIS",
  "node": "repository/iHRIS",
  "host": "github",
  "vcs": "git",
  "level": "repository",
  "refs": {
    "web": "https://github.com/iHRIS/iHRIS",
    "git": "https://github.com/iHRIS/iHRIS.git"
  },
  "repository": {
    "url": "https://github.com/iHRIS/iHRIS",
    "branch": "master",
    "commit": "fa66e9b375e38525236d28459ec5e5eb3875e2b2",
    "committedAt": "2026-09-07T11:18:19+03:00",
    "licence": "LGPL-3.0"
  },
  "capturedFrom": [
    "uploads/github/iHRIS.json"
  ],
  "capturedAt": "2026-09-22"
}
