{
  "$schema": "ihris-source-record/v1",
  "id": "milestone--i2ce--delete-record",
  "node": "milestone/i2ce/delete-record",
  "host": "launchpad",
  "vcs": "bzr",
  "level": "milestone",
  "refs": {
    "web": "https://launchpad.net/i2ce/+milestone/delete-record"
  },
  "release": {
    "name": "delete-record",
    "series": "trunk",
    "released": null,
    "expected": "2008-02-29",
    "registrant": null,
    "releaseNotes": null,
    "changelog": null,
    "files": []
  },
  "capturedFrom": [
    "uploads/launchpad/milestones/i2ce@delete-record.html",
    "uploads/launchpad/release-file-md5.tsv"
  ],
  "capturedAt": "2026-09-22"
}
