{
  "$schema": "ihris-source-record/v1",
  "id": "release--ihris-manage--4.0.16",
  "node": "release/ihris-manage/4.0.16",
  "host": "launchpad",
  "vcs": "bzr",
  "level": "release",
  "refs": {
    "web": "https://launchpad.net/ihris-manage/+milestone/4.0.16"
  },
  "release": {
    "name": "4.0.16",
    "series": "4.0",
    "released": "2011-06-30",
    "expected": null,
    "registrant": "Carl Leitner",
    "releaseNotes": null,
    "changelog": null,
    "files": [
      {
        "name": "ihris-manage-4.0.16.tar.bz2",
        "url": "https://launchpad.net/ihris-manage/4.0/4.0.16/+download/ihris-manage-4.0.16.tar.bz2",
        "md5": "913f361c5e468d9a759ad07d736e68f2"
      },
      {
        "name": "ihris-manage-full-4.0.16.tar.bz2",
        "url": "https://launchpad.net/ihris-manage/4.0/4.0.16/+download/ihris-manage-full-4.0.16.tar.bz2",
        "md5": "5fb604ef29e00b980ec552b24ef4c120"
      }
    ]
  },
  "capturedFrom": [
    "uploads/launchpad/milestones/ihris-manage@4.0.16.html",
    "uploads/launchpad/release-file-md5.tsv"
  ],
  "capturedAt": "2026-09-22"
}
