{
  "$schema": "ihris-source-record/v1",
  "id": "release--ihris-qualify--4.0.16",
  "node": "release/ihris-qualify/4.0.16",
  "host": "launchpad",
  "vcs": "bzr",
  "level": "release",
  "refs": {
    "web": "https://launchpad.net/ihris-qualify/+milestone/4.0.16"
  },
  "release": {
    "name": "4.0.16",
    "series": "4.0",
    "released": "2011-06-30",
    "expected": null,
    "registrant": "Carl Leitner",
    "releaseNotes": null,
    "changelog": null,
    "files": [
      {
        "name": "ihris-qualify-full-4.0.16.tar.bz2",
        "url": "https://launchpad.net/ihris-qualify/4.0/4.0.16/+download/ihris-qualify-full-4.0.16.tar.bz2",
        "md5": "3b26fdc8210c9ceaa19d9c3a627917f6"
      },
      {
        "name": "ihris-qualify-4.0.16.tar.bz2",
        "url": "https://launchpad.net/ihris-qualify/4.0/4.0.16/+download/ihris-qualify-4.0.16.tar.bz2",
        "md5": "0f424c38227a9c831fbc93268a0695ac"
      }
    ]
  },
  "capturedFrom": [
    "uploads/launchpad/milestones/ihris-qualify@4.0.16.html",
    "uploads/launchpad/release-file-md5.tsv"
  ],
  "capturedAt": "2026-09-22"
}
