{
  "$schema": "ihris-source-record/v1",
  "id": "project--ihris-manage-lesotho",
  "node": "project/ihris-manage-lesotho",
  "host": "launchpad",
  "vcs": "bzr",
  "level": "project",
  "refs": {
    "web": "https://launchpad.net/ihris-manage-lesotho"
  },
  "project": {
    "name": "ihris-manage-lesotho",
    "title": "ihris-manage-lesotho",
    "summary": "Implementation of iHRIS Manage in Lesotho",
    "description": null,
    "registered": "2010-08-24 12:42:36 UTC",
    "licences": [
      "GNU GPL v3"
    ],
    "languages": [],
    "homepage": null,
    "wiki": null,
    "maintainer": {
      "id": "~litlfred",
      "name": "Carl Leitner"
    },
    "partOf": "ihris-suite",
    "classification": "country-customization",
    "describedBy": null
  },
  "capturedFrom": [
    "uploads/launchpad/projects/ihris-manage-lesotho.html",
    "uploads/launchpad/projects/ihris-manage-lesotho.rdf",
    "uploads/launchpad/projects/ihris-manage-lesotho__series.html"
  ],
  "capturedAt": "2026-09-22"
}
