{
  "$schema": "ihris-source-record/v1",
  "id": "series--ihris-qualify--4.3",
  "node": "series/ihris-qualify/4.3",
  "host": "launchpad",
  "vcs": "bzr",
  "level": "series",
  "refs": {
    "lp": "lp:~intrahealth+informatics/ihris-qualify/4.3-dev",
    "web": "https://launchpad.net/ihris-qualify/4.3"
  },
  "series": {
    "name": "4.3",
    "isDevelopmentFocus": false,
    "branches": [
      "lp:~intrahealth+informatics/ihris-qualify/4.3-dev"
    ],
    "milestones": [
      "4.3.0",
      "4.3.2",
      "4.3.3"
    ]
  },
  "capturedFrom": [
    "uploads/launchpad/series/ihris-qualify@4.3.html"
  ],
  "capturedAt": "2026-09-22"
}
