{
  "$schema": "ihris-source-record/v1",
  "id": "release--ihris-common--4.1.12",
  "node": "release/ihris-common/4.1.12",
  "host": "launchpad",
  "vcs": "bzr",
  "level": "release",
  "refs": {
    "web": "https://launchpad.net/ihris-common/+milestone/4.1.12"
  },
  "release": {
    "name": "4.1.12",
    "series": "4.1",
    "released": "2015-08-18",
    "expected": null,
    "registrant": "Sovello Hildebrand",
    "releaseNotes": null,
    "changelog": null,
    "files": [
      {
        "name": "ihris-common-full-4.1.12.tar.bz2",
        "url": "https://launchpad.net/ihris-common/4.1/4.1.12/+download/ihris-common-full-4.1.12.tar.bz2",
        "md5": "531a76f171b451ee6c46f92a265e0fe9"
      },
      {
        "name": "ihris-common-4.1.12.tar.bz2",
        "url": "https://launchpad.net/ihris-common/4.1/4.1.12/+download/ihris-common-4.1.12.tar.bz2",
        "md5": "fdad37bfa966cec0083fcb1ae4d43158"
      }
    ]
  },
  "capturedFrom": [
    "uploads/launchpad/milestones/ihris-common@4.1.12.html",
    "uploads/launchpad/release-file-md5.tsv"
  ],
  "capturedAt": "2026-09-22"
}
