{
  "$schema": "ihris-source-record/v1",
  "id": "project--ihris-dr",
  "node": "project/ihris-dr",
  "host": "launchpad",
  "vcs": "bzr",
  "level": "project",
  "refs": {
    "lp": "lp:ihris-dr",
    "web": "https://launchpad.net/ihris-dr"
  },
  "project": {
    "name": "ihris-dr",
    "title": "iHRIS Dominican Republic",
    "summary": "Customizations for iHRIS for the Dominican Republic.",
    "description": null,
    "registered": "2016-02-08 14:13:52 UTC",
    "licences": [
      "GNU GPL v3"
    ],
    "languages": [],
    "homepage": null,
    "wiki": null,
    "maintainer": {
      "id": "~ihris+dr",
      "name": "iHRIS Dominican Republic"
    },
    "partOf": "ihris-suite",
    "classification": "country-customization",
    "describedBy": null
  },
  "capturedFrom": [
    "uploads/launchpad/projects/ihris-dr.html",
    "uploads/launchpad/projects/ihris-dr.rdf",
    "uploads/launchpad/projects/ihris-dr__series.html"
  ],
  "capturedAt": "2026-09-22"
}
